{"schemaVersion":"1.1.0","variant":{"id":"chr1-109274968-G-T","chromosome":"chr1","position":109274968,"ref":"G","alt":"T","rsid":"rs12740374"},"provenance":{"source":"model-api","clientVersion":"0.9.0","pipelineVersion":"0.1.0","queriedAt":"2026-09-13T14:04:00Z","configHash":"a3d9e31f29df7586","calibrationEpoch":"quantiles>=2026-06-18,indels>=2026-07-14","notes":"predict_variant aparte, con ontology_terms fijado al biosample declarado."},"biosample":{"name":"HepG2","ontologyCurie":"EFO:0001187"},"finding":"La estructura tridimensional del locus no se mueve. El cambio mayor de toda la ventana es una perdida minima de un contacto de largo alcance que si parte del propio bin de la variante, pero su tamano es una fraccion minuscula del relieve que tiene el mapa de fondo: el color casi no se despega del cero, y no porque se le haya puesto una escala generosa, sino porque el dominio es fijo y esta anclado a lo que costaria reorganizar un dominio topologico. A esta resolucion un solo cambio de base rara vez reordena el plegado, y el modelo predice que esta tampoco lo hace. El mecanismo publicado de esta variante es de union de un factor de transcripcion, no de arquitectura, asi que una modalidad callada aqui es coherente, no un fallo. Es el mismo patron que ya aparece en el catalogo cuando a una variante se le pide la modalidad que no le toca.","status":"ok","interval":{"chromosome":"chr1","start":109141848,"end":109406040},"predictedInterval":{"chromosome":"chr1","start":108750680,"end":109799256},"resolution":2048,"bins":129,"variantBin":64,"domain":1.0,"visibleThreshold":0.1,"maxAbsDelta":0.039062,"maxAbsDeltaAt":{"fullBin":380,"insideDrawnWindow":false,"involvesVariantBin":true,"separationBp":256000,"ref":1.070312,"alt":1.03125},"variantRowMeanAbsDelta":0.01427,"referenceRange":{"min":-0.746094,"max":1.9375,"p1":-0.582031,"p99":0.820312},"scales":{"reference":0.001,"delta":1e-05},"reference":[-365,-281,-232,-48,26,5,36,98,91,125,181,137,178,177,202,215,220,275,244,275,322,424,418,459,434,383,268,273,180,115,81,105,68,18,-15,-146,-178,-188,-194,-180,-167,-148,-112,-89,-112,-101,-44,6,27,7,1,20,96,102,114,153,155,180,188,119,81,63,43,-1,-40,-94,-160,-218,-249,-277,-348,-371,-359,-354,-328,-318,-334,-297,-279,-275,-283,-258,-252,-230,-285,-275,-293,-295,-295,-307,-283,-279,-279,-275,-277,-271,-264,-279,-266,-266,-223,-227,-186,-193,-185,-164,-156,-121,-151,-159,-174,-148,-164,-170,-138,-114,-90,-54,-11,37,57,132,186,215,232,254,279,104,68,-539,-312,-231,-97,-91,-21,25,21,75,117,67,125,109,148,141,165,215,191,229,252,375,371,383,395,336,192,230,137,56,32,55,18,-26,-38,-188,-222,-230,-234,-227,-215,-195,-161,-135,-142,-147,-91,-41,-20,-40,-48,0,60,61,80,115,112,139,146,114,41,16,2,-45,-80,-137,-198,-256,-268,-311,-383,-400,-393,-389,-359,-348,-361,-326,-311,-291,-303,-279,-277,-252,-307,-297,-316,-320,-320,-332,-303,-305,-281,-297,-297,-295,-287,-301,-291,-289,-248,-254,-214,-221,-210,-189,-184,-147,-132,-184,-198,-171,-191,-197,-166,-143,-123,-84,-43,1,23,106,158,184,202,228,241,178,32,-439,-221,-215,-146,-50,34,10,69,129,68,125,126,150,157,155,230,196,243,270,371,383,396,371,342,208,224,146,67,38,55,26,-17,-31,-169,-217,-229,-233,-215,-211,-188,-158,-131,-132,-119,-86,-32,-16,-31,-40,9,83,64,78,123,121,146,156,123,73,29,14,-33,-73,-131,-193,-252,-264,-295,-367,-391,-381,-377,-352,-340,-354,-318,-303,-283,-293,-275,-268,-242,-297,-287,-309,-311,-309,-320,-293,-297,-279,-277,-289,-285,-275,-291,-281,-279,-235,-242,-205,-210,-200,-181,-175,-141,-124,-131,-186,-162,-182,-188,-157,-134,-111,-75,-36,10,31,107,160,188,202,228,250,191,153,-301,-185,-225,-67,43,57,88,146,116,156,154,195,188,208,254,238,273,311,410,406,439,420,354,240,260,166,93,64,89,45,6,1,-141,-171,-198,-210,-188,-177,-165,-133,-108,-107,-95,-32,0,20,3,-12,42,119,112,118,161,161,188,197,163,116,97,47,7,-25,-88,-156,-216,-229,-268,-340,-363,-354,-352,-324,-311,-324,-291,-275,-260,-266,-241,-246,-225,-277,-270,-287,-287,-291,-301,-275,-277,-252,-252,-252,-262,-258,-271,-262,-256,-220,-221,-190,-193,-182,-162,-156,-119,-105,-112,-126,-144,-171,-171,-141,-115,-93,-57,-21,27,48,123,173,207,218,242,268,216,176,-275,-214,-169,1,36,106,140,109,173,154,196,203,203,270,236,293,316,432,418,434,430,377,237,277,184,103,74,97,81,17,-3,-135,-177,-188,-217,-200,-185,-152,-144,-114,-111,-100,-34,20,22,2,-9,40,109,95,131,159,163,194,202,161,122,100,79,13,-26,-84,-160,-218,-232,-268,-344,-371,-361,-354,-322,-312,-322,-289,-279,-268,-273,-252,-244,-238,-279,-273,-289,-291,-293,-303,-279,-287,-258,-260,-262,-249,-266,-279,-266,-258,-222,-226,-192,-197,-184,-167,-162,-127,-116,-122,-133,-107,-175,-180,-146,-124,-101,-71,-30,11,37,106,160,199,226,245,266,209,169,-389,-228,-166,-73,33,104,42,109,116,140,144,154,202,187,217,266,371,373,385,365,324,185,215,137,56,29,55,39,2,-37,-170,-212,-227,-236,-229,-213,-187,-151,-138,-145,-129,-59,-8,10,-30,-39,15,91,90,105,152,127,157,166,132,88,67,52,8,-46,-110,-180,-235,-246,-285,-359,-385,-373,-367,-346,-326,-342,-309,-293,-275,-279,-258,-254,-225,-289,-281,-303,-305,-305,-316,-289,-293,-271,-273,-268,-264,-256,-285,-277,-271,-228,-236,-197,-205,-195,-173,-170,-130,-118,-127,-142,-107,-136,-185,-155,-128,-107,-71,-29,15,31,114,165,194,210,236,262,210,169,-336,-149,-175,-7,84,58,101,107,153,145,152,214,180,229,252,379,367,389,367,303,177,207,116,47,22,50,29,-8,-12,-177,-216,-233,-241,-222,-219,-195,-161,-136,-151,-138,-74,-27,-1,-21,-50,2,74,73,91,137,133,136,150,113,76,56,39,-4,-44,-116,-184,-236,-247,-293,-363,-391,-381,-379,-354,-336,-352,-318,-303,-285,-287,-270,-258,-235,-291,-287,-305,-309,-309,-318,-293,-299,-277,-277,-273,-266,-258,-273,-277,-275,-230,-237,-198,-210,-198,-176,-171,-139,-124,-131,-146,-116,-140,-146,-158,-134,-112,-81,-39,3,22,98,150,185,205,228,262,209,169,-244,-163,-94,55,48,127,112,162,175,168,228,209,232,277,373,391,393,385,312,181,231,137,57,43,72,60,15,7,-133,-195,-208,-214,-195,-179,-171,-135,-119,-120,-119,-55,-7,22,5,-8,28,100,87,106,149,147,175,167,127,91,70,53,13,-22,-77,-156,-206,-220,-262,-334,-359,-344,-348,-322,-309,-314,-285,-271,-256,-258,-240,-237,-219,-268,-260,-285,-291,-289,-301,-275,-281,-260,-254,-258,-249,-240,-252,-238,-249,-210,-217,-182,-188,-175,-156,-146,-118,-102,-105,-115,-86,-108,-112,-80,-108,-83,-49,-8,36,56,123,175,210,231,258,277,225,186,-334,-145,-95,-64,48,74,102,113,123,173,147,193,216,334,326,350,326,279,133,168,94,16,-5,24,13,-28,-48,-185,-227,-260,-268,-250,-230,-205,-185,-165,-159,-148,-96,-49,-21,-40,-51,3,52,58,69,116,116,145,147,95,63,43,20,-20,-61,-122,-194,-241,-254,-297,-361,-391,-377,-373,-350,-332,-350,-312,-297,-279,-283,-260,-250,-227,-283,-273,-293,-299,-299,-309,-283,-283,-271,-266,-268,-258,-249,-268,-249,-252,-225,-229,-198,-207,-196,-175,-171,-136,-122,-130,-146,-123,-146,-149,-117,-90,-116,-85,-44,-1,18,83,136,165,183,214,240,197,155,-247,-102,-173,-11,44,106,98,112,172,143,184,228,320,336,338,340,270,150,181,95,26,0,32,21,-15,-10,-167,-216,-228,-249,-228,-212,-182,-145,-139,-135,-118,-55,-19,9,-7,-16,33,100,79,100,139,150,176,186,146,107,84,58,17,-18,-85,-164,-221,-233,-275,-348,-367,-352,-350,-322,-309,-320,-289,-271,-260,-260,-238,-233,-213,-260,-246,-262,-264,-271,-281,-258,-256,-248,-240,-243,-229,-222,-238,-230,-226,-179,-204,-177,-185,-169,-153,-146,-116,-103,-107,-125,-102,-127,-128,-104,-69,-47,-69,-35,15,32,96,151,179,203,238,258,213,174,-106,-96,-38,69,143,164,157,219,201,229,270,379,373,385,365,318,186,230,144,57,34,68,59,8,0,-127,-192,-212,-213,-202,-183,-155,-108,-85,-107,-87,-17,24,48,30,17,69,133,119,136,189,194,217,229,186,156,131,101,57,15,-46,-134,-188,-202,-242,-316,-342,-326,-322,-297,-287,-297,-256,-247,-235,-243,-218,-208,-181,-231,-223,-238,-238,-241,-260,-236,-235,-219,-218,-218,-203,-199,-217,-203,-204,-152,-159,-150,-155,-149,-127,-123,-86,-75,-82,-98,-74,-94,-99,-69,-38,-13,29,3,52,66,136,189,221,244,275,297,254,206,-383,-163,-157,-14,39,63,112,93,137,160,273,283,287,283,193,74,110,42,-48,-61,-20,-34,-60,-80,-210,-268,-285,-287,-266,-256,-229,-188,-160,-171,-160,-96,-48,-26,-46,-58,-10,65,57,80,115,118,153,162,122,90,61,39,-4,-46,-111,-186,-240,-256,-312,-377,-396,-381,-379,-352,-336,-348,-316,-297,-283,-285,-266,-254,-229,-277,-271,-287,-291,-289,-301,-279,-283,-268,-268,-262,-250,-244,-260,-250,-248,-197,-207,-166,-201,-191,-170,-166,-131,-117,-126,-142,-120,-150,-149,-124,-84,-62,-19,27,2,21,91,144,186,203,234,266,206,157,-218,-102,-83,33,85,162,123,159,205,297,303,312,287,217,76,121,51,-28,-41,-1,-20,-55,-58,-204,-258,-275,-279,-256,-225,-216,-169,-145,-146,-129,-74,-31,-5,-22,-35,15,76,73,98,146,148,181,182,135,114,94,62,13,-32,-93,-174,-226,-241,-287,-365,-377,-363,-357,-328,-316,-332,-295,-273,-258,-271,-246,-234,-208,-256,-250,-264,-266,-264,-279,-252,-264,-250,-246,-237,-230,-223,-240,-226,-229,-174,-185,-148,-155,-173,-153,-147,-117,-100,-108,-123,-109,-132,-134,-103,-73,-46,-9,39,91,31,96,148,178,207,240,262,209,168,-228,-113,-119,6,109,95,115,157,262,256,266,256,157,37,62,9,-68,-75,-35,-50,-95,-91,-221,-281,-303,-297,-277,-254,-225,-186,-163,-166,-144,-75,-45,-26,-35,-44,5,68,64,84,126,137,171,174,124,105,80,52,7,-42,-105,-182,-227,-241,-289,-365,-396,-365,-359,-336,-324,-338,-305,-279,-266,-277,-249,-241,-213,-266,-256,-273,-273,-275,-289,-262,-260,-258,-254,-247,-239,-232,-249,-238,-237,-186,-190,-159,-163,-148,-157,-151,-121,-108,-112,-130,-103,-131,-133,-102,-73,-47,-3,40,97,118,105,155,185,216,248,262,215,158,-230,-122,-117,60,65,116,139,244,260,258,248,151,18,61,4,-74,-68,-34,-51,-77,-84,-208,-273,-293,-283,-264,-237,-215,-152,-142,-150,-128,-62,-29,-12,-22,-28,24,94,88,108,145,150,187,197,151,124,97,72,27,-16,-83,-160,-207,-229,-277,-352,-381,-365,-342,-322,-305,-324,-287,-264,-254,-260,-235,-232,-204,-258,-248,-268,-270,-268,-279,-254,-258,-242,-248,-247,-235,-226,-239,-233,-229,-182,-189,-157,-156,-144,-120,-148,-113,-102,-108,-126,-100,-125,-126,-99,-68,-42,3,48,108,126,211,171,199,228,260,281,224,168,-355,-203,-134,-65,21,74,170,184,209,187,86,-50,-7,-62,-143,-144,-91,-119,-141,-136,-271,-332,-350,-342,-322